{
  "report_id": "REPORT_20260305_082926",
  "task_id": "TASK_01_FETCH_POPULATION",
  "agent_type": "background_agent",
  "status": "completed",
  "completed_at": "2026-03-05T08:29:26.234915Z",
  "duration_seconds": 0,
  "outputs": {
    "scripts/01_fetch_population.py": {
      "path": "C:\\Users\\haujo\\projects\\DEV\\Data_visualization\\world_populations\\scripts\\01_fetch_population.py",
      "size_bytes": 3783,
      "created_at": "2026-03-05T08:29:26.231007Z",
      "exists": true
    }
  },
  "implemented_functions": [],
  "code_quality": {
    "syntax_valid": true,
    "can_import": true
  },
  "validation_results": {
    "all_expected_outputs_exist": true,
    "all_required_functions_present": false
  },
  "errors": [],
  "ready_for_verification": true
}